{
  "receipt_version": "agentic_tournament_v0.1",
  "authority": false,
  "claim_level": "observation_only",
  "operator": "Jay Wisdom",
  "identity_anchor": "jaywisdom.eth",
  "cycle": {
    "receipt_id": "AGENTIC-CYCLE-001",
    "squad_version": "v0.1",
    "timestamp_start": "",
    "timestamp_end": "",
    "qualifier_window": "",
    "map_or_mode": ""
  },
  "squad_vector": {
    "agents": [],
    "primary_objective": "Qualify through durable resource accumulation while avoiding negative-value fights.",
    "secondary_objective": "Capture opportunistic objectives only when local advantage is present.",
    "risk_budget": "Preserve squad survivability over short-term combat upside.",
    "operating_posture": "Survive first, farm second, fight only with advantage."
  },
  "triggers": {
    "survival_priority": {
      "conditions": [
        "agent_survivability_below_safe_threshold",
        "squad_outnumbered_locally",
        "fight_becomes_negative_resource_trade"
      ],
      "actions": [
        "disengage",
        "regroup",
        "preserve_agent",
        "resume_safer_route"
      ]
    },
    "resource_differential_fallback": {
      "conditions": [
        "enemy_resource_lead_exceeds_threshold",
        "repeated_engagement_losses_in_same_zone",
        "objective_cost_exceeds_expected_reward"
      ],
      "actions": [
        "abandon_contested_zone",
        "farm_safer_route",
        "delay_combat",
        "reenter_after_resource_parity_improves"
      ]
    },
    "advantage_engagement": {
      "conditions": [
        "local_advantage_detected",
        "enemy_isolated_or_weakened",
        "objective_reward_exceeds_survival_risk"
      ],
      "actions": [
        "focus_fire",
        "secure_objective",
        "exit_before_counter_collapse"
      ]
    }
  },
  "telemetry": {
    "wins": 0,
    "losses": 0,
    "resources_gained": 0,
    "deaths": 0,
    "objectives_captured": 0,
    "retreats_triggered": 0,
    "failed_triggers": [],
    "unexpected_behavior": []
  },
  "failure_modes": [
    "overfight_loop",
    "late_retreat",
    "farm_paralysis"
  ],
  "next_delta": {
    "keep": [],
    "remove": [],
    "modify": [],
    "single_delta": "",
    "redeploy_version": "v0.2"
  }
}
